region,title,address,phone,score,open_time,comment1,comment2,comment3
花蓮縣,老邵和平店江浙佳餚美食餐廳,花蓮縣花蓮市和平路536-1號,'038311901',3.9,"{""星期一"": ""11:00–14:00、17:00–20:00"", ""星期二"": ""休息"", ""星期三"": ""11:00–14:00、17:00–20:00"", ""星期四"": ""11:00–14:00、17:00–20:00"", ""星期五"": ""11:00–14:00、17:00–20:00"", ""星期六"": ""11:00–14:00、17:00–20:00"", ""星期日"": ""11:00–14:00、17:00–20:00""}","""小籠湯包，炒貓耳朵，酸辣湯不錯。牛肉湯頭像藥燉排骨，蔥油餅薄脆""","""停車方便，左宗棠雞好吃，炒飯沒青蔥花，服務人員服務態度可以再加點溫度","""用餐空間大，有特色小菜，湯包，水餃都好吃"""
花蓮縣,時光1939,花蓮縣花蓮市民國路80巷16號,'038321939',4.5,"{""星期一"": ""09:00–17:00"", ""星期二"": ""09:00–17:00"", ""星期三"": ""休息"", ""星期四"": ""休息"", ""星期五"": ""09:00–17:00"", ""星期六"": ""09:00–17:00"", ""星期日"": ""09:00–17:00""}","""環境有氣氛，份量足夠，有質感不花俏，吃得出料理的用心與對食材堅持的蔬食。""","""日式古老建築的早午餐素食口味的餐廳，套餐美味又漂亮。""","""而成為目前一個結合蔬食、書籍、咖啡、手作雜貨的空間。所以說她是間有故事的店。"""
花蓮縣,拉麵 匠心食堂,花蓮縣花蓮市明禮路12號,'038316399',4.0,"{""星期一"": ""17:45–19:45"", ""星期二"": ""11:45–13:45、17:45–19:45"", ""星期三"": ""17:45–19:45"", ""星期四"": ""11:45–13:45、17:45–19:45"", ""星期五"": ""11:45–13:45、17:45–19:45"", ""星期六"": ""休息"", ""星期日"": ""17:45–19:45""}","""餐點口味平衡，惟叉燒有些過爛，CP值相符，在花蓮拉麵店中算是排名極高。""","""裝潢精緻，很有氣氛。提供像日本的冰塊水，台灣第一次看過。不提供電話，不能訂位。""","""最後一定要來個甜點，我們點了季節點心是櫻花🌸和布丁；無論是口感或擺飾都相當喜歡。"""
花蓮縣,美侖大飯店-鄉園中餐廳,花蓮縣花蓮市林園11號,'038222111',3.8,"{""星期一"": ""11:30–14:00、17:30–21:00"", ""星期二"": ""11:30–14:00、17:30–21:00"", ""星期三"": ""11:30–14:00、17:30–21:00"", ""星期四"": ""11:30–14:00、17:30–21:00"", ""星期五"": ""11:30–14:00、17:30–21:00"", ""星期六"": ""11:30–14:00、17:30–21:00"", ""星期日"": ""11:30–14:00、17:30–21:00""}","""烤鴨偏鹹、花東洛神花雞球普通、介蘭滑牛肉不錯蠻嫩，服務不錯住宿也OK。""","""吃港式料理單點 不太好吃 烤鴨太鹹都沒啥肉 都骨頭 糯米雞米心沒透 蠻多道都太鹹""","""環境棒, 有些餐點不錯吃推, 鮮蝦板條"
花蓮縣,田莊餐廳,花蓮縣吉安鄉自立路二段100-2號973號號,'0928876089',4.1,"{""星期一"": ""11:30–14:00、17:30–21:00"", ""星期二"": ""11:00–14:00、17:30–21:00"", ""星期三"": ""11:30–14:00、17:30–21:00"", ""星期四"": ""11:30–14:00、17:30–21:00"", ""星期五"": ""11:30–14:00、17:30–21:00"", ""星期六"": ""11:30–14:00、17:30–21:00"", ""星期日"": ""11:30–14:00、17:30–21:00""}","""物美價廉，服務親切，好停車，老闆娘手藝很好。""","""好吃， 雞肉鮮甜，米糕美味，藥燉排骨很清甜，魚很鮮喔！""","""第二次跟家人去吃，每樣菜餚都好吃 推薦 四神排骨湯/滷豬腳▪︎▪︎▪︎都好吃"""
花蓮縣,庸的廚房 | 花蓮美食,花蓮縣花蓮市中華路489號,'038512926',4.6,"{""星期一"": ""休息"", ""星期二"": ""11:30–14:00、17:30–20:30"", ""星期三"": ""11:30–14:00、17:30–20:30"", ""星期四"": ""11:30–14:00、17:30–20:30"", ""星期五"": ""11:30–14:00、17:30–20:30"", ""星期六"": ""11:30–14:00、17:30–20:30"", ""星期日"": ""11:30–14:00""}","""西湖牛肉羹，是牛肉絞肉及蛋花當主角，加在類似酸辣湯的羹湯。可以額外加醋。""","""廚藝很好 每個招牌都必點 香酥鴨 橙汁排骨 茄子肥腸煲 中蝦 都好讚""","""在花蓮市吉安附近的溫馨小店，食材新鮮，老闆娘很親切，還有老闆的好手藝！"""
花蓮縣,浪花丸 かき氷·島食,花蓮縣花蓮市海濱街31號,'038327331',4.6,"{""星期一"": ""13:00–18:00"", ""星期二"": ""休息"", ""星期三"": ""休息"", ""星期四"": ""13:00–18:00"", ""星期五"": ""13:00–18:00"", ""星期六"": ""13:00–18:00"", ""星期日"": ""13:00–18:00""}","""寵物友善 服務態度很棒 主動提供清冰給狗狗消暑 小雞造型也很可愛 抹茶紅豆冰好吃""","""冰品有創意 口味獨特 小而美的店面座無虛席 -咖啡凍煉乳冰 -藍色夏威夷煉乳刨冰","""價格親民造型可愛又好吃，店內造景很有沖繩風，非常推薦造訪吃冰品拍美照👍"""
花蓮縣,芝麻開門 日式定食屋,花蓮縣花蓮市博愛街138號,'038346659',4.2,"{""星期一"": ""11:30–13:30、17:00–20:30"", ""星期二"": ""11:30–13:30、17:00–20:30"", ""星期三"": ""11:30–13:30、17:00–20:30"", ""星期四"": ""11:30–13:30、17:00–20:30"", ""星期五"": ""11:30–13:30、17:00–20:30"", ""星期六"": ""11:30–13:30、17:00–20:30"", ""星期日"": ""11:30–13:30、17:00–20:30""}","""餐廳氣氛佳，食物美味道地，日本師傅手藝好，算中低價位，約會、聚餐好處所""","""柚子醬豬排跟唐揚雞都令人驚豔，搭配啤酒非常享受。推薦給吃膩花蓮小吃的朋友""","""烤魚魚皮酥魚肉軟一點魚腥味都沒生魚片原切魚肉Q，炸物也好吃白飯香甜。"""
花蓮縣,王子 廚義,花蓮縣花蓮市民國路67號,'038326268',4.3,"{""星期一"": ""11:00–20:30"", ""星期二"": ""11:00–20:30"", ""星期三"": ""休息"", ""星期四"": ""11:00–20:30"", ""星期五"": ""11:00–20:30"", ""星期六"": ""11:00–20:30"", ""星期日"": ""11:00–20:30""}","""早鳥餐點跟飲料，CP值不錯，適合帶小孩，有孩童餐具，外面還有水池可看小魚小蝦。""","""餐點還不錯 番茄義大利麵和田園蔬菜比薩好吃 有提供紅茶 檸檬水和水果醋自取""","""夏威夷披薩普普 料少 抹茶咖啡拉花不如不要拉⋯ 烤布蕾只有表層熱 下面是冰的⋯"""
花蓮縣,叁丸日式料理,花蓮縣花蓮市林森路293巷8號,'038360999',4.1,"{""星期一"": ""11:00–14:00、17:00–20:30"", ""星期二"": ""11:00–14:00、17:00–20:30"", ""星期三"": ""休息"", ""星期四"": ""11:00–14:00、17:00–20:30"", ""星期五"": ""11:00–14:00、17:00–20:30"", ""星期六"": ""11:00–14:00、17:00–20:30"", ""星期日"": ""11:00–14:00、17:00–20:30""}","""點了胭脂蝦、豆腐、魚頭味增湯、冰壽司，口味不錯也有特色。""","""好吃～點了鮭魚炒飯、鹽烤松阪豬（肉量很多）、鮭魚生魚片～點的東西都很好吃😋""","""氣氛好服務很棒，生魚片新鮮好吃，帶小朋友也很方便，每次到花蓮來一定要吃的好店"
花蓮縣,Dolphinu義式食坊,花蓮縣花蓮市成功街232號,'038345591',4.6,"{""星期一"": ""休息"", ""星期二"": ""休息"", ""星期三"": ""11:30–14:00、17:30–21:00"", ""星期四"": ""11:30–14:00、17:30–21:00"", ""星期五"": ""11:30–14:00、17:30–21:00"", ""星期六"": ""11:30–14:00、17:30–21:00"", ""星期日"": ""11:30–14:00、17:30–21:00""}","""套餐在550-600上下，沙拉麵包濃湯飲料主餐到甜點都很用心。首推墨魚麵👍""","""料理精緻美味，用餐氣氛非常棒，服務專業，搭配餐酒真是完美盡興的享受。""","""今晚我點的是牛肉燉飯套餐，飯後喝熱奶茶、冰品套餐650元，果然很好吃！"""
花蓮縣,花蓮美侖大飯店綠苑西餐廳,花蓮縣花蓮市林園11號,'038222111',3.9,"{""星期一"": ""06:00–10:00、11:30–14:00、14:30–16:30、17:30–21:00"", ""星期二"": ""06:00–10:00、11:30–14:00、14:30–16:30、17:30–21:00"", ""星期三"": ""06:00–10:00、11:30–14:00、14:30–16:30、17:30–21:00"", ""星期四"": ""06:00–10:00、11:30–14:00、14:30–16:30、17:30–21:00"", ""星期五"": ""06:00–10:00、11:30–14:00、14:30–16:30、17:30–21:00"", ""星期六"": ""06:00–10:00、11:30–14:00、14:30–16:30、17:30–21:00"", ""星期日"": ""06:00–10:00、11:30–14:00、14:30–16:30、17:30–21:00""}","""吃到 道地北海道 #一幻拉麵 🍜 #每日限量，打卡還有機會抽雙人住宿劵，太棒了！""","""糖果區，是特別設計過的台灣古早味零食， 小朋友們都很喜歡！""","""以元旦ㄧ人800,有牛排，海鮮，甜點，飲料，cp值很高了"""
花蓮縣,竹陽活海鮮/花蓮美食/花蓮小吃/花蓮海鮮餐廳/花蓮必吃/花蓮美食推薦/花蓮活海鮮/花蓮合菜,花蓮縣花蓮市節約街40號,'038353178',3.9,"{""星期一"": ""10:00–14:00、17:00–21:00"", ""星期二"": ""10:00–14:00、17:00–21:00"", ""星期三"": ""10:00–14:00、17:00–21:00"", ""星期四"": ""10:00–14:00、17:00–21:00"", ""星期五"": ""10:00–14:00、17:00–21:00"", ""星期六"": ""10:00–14:00、17:00–21:00"", ""星期日"": ""10:00–14:00、17:00–21:00""}","""烤松阪豬，蚵仔湯，炒麵，炒水蓮，三杯中卷，烤魚很好吃，價格合理，CP值高。""","""點了白酌蝦,牡蠣滑蛋,地瓜葉,生魚片,價格公道蝦子鮮""","""海鮮麵／100元料多可惜太鹹了=“=。下回要提醒廚師少鹽少醬油。"""
花蓮縣,Old Germany 德國餐廳,花蓮縣花蓮市府前路94號,'038220878',4.3,"{""星期一"": ""11:30–14:00、17:00–21:00"", ""星期二"": ""11:30–14:00、17:00–21:00"", ""星期三"": ""11:30–14:00、17:00–21:00"", ""星期四"": ""11:30–14:00、17:00–21:00"", ""星期五"": ""11:30–14:00、17:00–21:00"", ""星期六"": ""11:30–14:00、17:00–21:00"", ""星期日"": ""11:30–14:00、17:00–21:00""}","""豬肋排、匈牙利牛肉飯、義大利肉醬麵都是道地口味，超級好吃，CP值超高！""","""豬腳現烤需等候30分鐘 皮Q肉嫩 羊肉燉飯跟白啤酒🍻好吃也好喝""","""原是不食人間烟火的台灣女孩，必須在廚房油煙中打理著人間美食。"""
花蓮縣,傑米料理,花蓮縣花蓮市莊敬路202號,None,4.2,"{""星期一"": ""11:00–14:00、17:00–20:30"", ""星期二"": ""11:00–14:00、17:00–20:30"", ""星期三"": ""11:00–14:00、17:00–20:30"", ""星期四"": ""11:00–14:00、17:00–20:30"", ""星期五"": ""11:00–14:00、17:00–20:30"", ""星期六"": ""11:00–14:00、17:00–20:30"", ""星期日"": ""休息""}","""熟成紐約客牛排，鰤魚海鮮丼，明太子雞腿燉飯，餐點有夠好吃，值得再訪。""","""花蓮好山好水好料理，老闆喜歡人家照規矩訂餐，如果照規矩，他就會給你好料理好服務","""牛排先知鴨生魚片鮑魚海膽手捲最後再來個小甜點 很幸福喔～～～"""
花蓮縣,香茅廚房《Lemongrass Kitchen》花蓮美食/花蓮餐廳/花蓮泰式料理/花蓮必吃/花蓮聚餐/寵物親子友善餐廳,花蓮縣花蓮市商校街175號,'038322685',4.8,"{""星期一"": ""休息"", ""星期二"": ""休息"", ""星期三"": ""11:30–14:00、17:30–20:00"", ""星期四"": ""11:30–14:00、17:30–20:00"", ""星期五"": ""11:30–14:00、17:30–20:00"", ""星期六"": ""11:30–14:00、17:30–20:00"", ""星期日"": ""11:30–14:00、17:30–20:00""}","""很棒的泰國菜，黃咖哩軟殼蟹，紅咖哩牛肉，濃濃香茅及咖哩香料，可以感覺到主廚的用心""","""炸雞和炸豆腐好吃，炸衣是白皮，較有黏性的 海鮮冬蔭麵辣中帶甜，海鮮量給蠻足夠的""","""，炸香蕉、泰式奶茶有別於一般泰式甜點，適合家庭、同事及朋友聚餐CP值超高的餐廳。"""
花蓮縣,愛上這味懷舊餐廳,花蓮縣花蓮市林森路280號1樓,'038359527',4.2,"{""星期一"": ""17:00–23:00"", ""星期二"": ""17:00–23:00"", ""星期三"": ""17:00–23:00"", ""星期四"": ""休息"", ""星期五"": ""17:00–23:00"", ""星期六"": ""11:00–14:00、17:00–22:00"", ""星期日"": ""11:00–14:00、17:00–22:00""}","""餐點口味還可以！人少不建議前往～ 鹹豬肉、檸檬汁大推～醬油蛋真的要配飯吃！""","""螃蟹海鮮粥必點，好吃份量大，醬燒茄子也好吃，古早味炒蛋及客家小炒都很棒","""湯的份量超大好喝，菜色品質也不錯，環境很乾淨，復古味蠻有風格"
花蓮縣,米噹泰式燒烤,花蓮縣花蓮市重慶路221-2號,'038357031',4.2,"{""星期一"": ""18:00–01:00"", ""星期二"": ""休息"", ""星期三"": ""18:00–01:00"", ""星期四"": ""18:00–01:00"", ""星期五"": ""18:00–01:00"", ""星期六"": ""18:00–01:00"", ""星期日"": ""18:00–01:00""}","""烤魚的魚很多種類，烤肉跟花枝超棒，酸辣，配上洋蔥，魚皮50元一份，份量很多""","""特色的啤酒燒烤店，停車方便，空間寬敞，不會有油煙味，每樣餐點都好吃，服務親切""","""也點了炒飯、粿仔條、青菜、魚下巴、蝦子、蚵、青木瓜、熱狗。"""
花蓮縣,鵝肉先生,花蓮縣花蓮市中山路259號,'038331902',3.8,"{""星期一"": ""11:00–20:00"", ""星期二"": ""11:00–20:00"", ""星期三"": ""11:00–20:00"", ""星期四"": ""休息"", ""星期五"": ""11:00–20:00"", ""星期六"": ""11:00–20:00"", ""星期日"": ""11:00–20:00""}","""鵝肉跟醬料、山蘇、湯米粉好吃 炸蚵仔可能外帶軟濕不脆了 油雞部位不好⋯""","""拿菜單點餐等上菜，出餐速度快，服務態度尚可，內用客人很多，防疫期間室外也有位子。""","""我是花蓮人，回鄉必吃鵝肉先生，超好吃店員大哥會介紹菜色，很推薦來花蓮玩的朋友"""
花蓮縣,小小洋房,花蓮縣花蓮市民德一街32號1樓,'038311610',4.5,"{""星期一"": ""11:30–20:00"", ""星期二"": ""休息"", ""星期三"": ""休息"", ""星期四"": ""11:30–20:00"", ""星期五"": ""11:30–20:00"", ""星期六"": ""11:30–20:00"", ""星期日"": ""11:30–20:00""}","""雖然蜜糖吐司剛好賣完了沒吃到，點了鮮蝦塔可飯跟印度咖哩雞肉飯，蠻有特色的。""","""巷弄裡的優質餐廳，環境優雅。裝潢用心。餐點也好吃（希望鬆餅部分可以趁熱出餐）""","""日式精緻風格的洋食屋。很適合花蓮旅行的早午餐，健康的食物提供一天滿滿的活力。"""
花蓮縣,閹雞城餐廳,花蓮縣花蓮市國聯二路70-1號,'038355989',3.8,"{""星期一"": ""11:00–14:00、17:00–21:00"", ""星期二"": ""11:00–14:00、17:00–21:00"", ""星期三"": ""11:00–14:00、17:00–21:00"", ""星期四"": ""11:00–14:00、17:00–21:00"", ""星期五"": ""11:00–14:00、17:00–21:00"", ""星期六"": ""11:00–14:00、17:00–21:00"", ""星期日"": ""11:00–14:00、17:00–21:00""}","""雞肉超級厲害、德國豬腳也不能錯過，招牌雞湯非常鮮美，花蓮必吃桌菜餐廳。""","""餐點超好吃，連不愛吃東西的兒子都連吃4碗飯，第5碗在我們強烈的阻止下才放下筷子。""","""餐廳菜色豐富，有魚，蝦，雞，豬及青菜。"""
花蓮縣,八丼手作日式料理,花蓮縣花蓮市商校街196號,'038322236',4.5,"{""星期一"": ""11:00–13:00、17:00–20:00"", ""星期二"": ""11:00–13:00、17:00–20:00"", ""星期三"": ""11:00–13:00、17:00–20:00"", ""星期四"": ""11:00–13:00、17:00–20:00"", ""星期五"": ""11:00–13:00、17:00–20:00"", ""星期六"": ""11:00–13:00、17:00–20:00"", ""星期日"": ""11:00–13:00、17:00–20:00""}","""吃粗飽的食堂、牡丹蝦丼、炸蝦丼、燒肉、炙燒牛肉壽司、茶碗蒸、不合口味的味增湯。""","""家長拿土瓶蒸蓋子裝湯給小朋友喝 結果被小孩打掉 老闆也說什麼 也沒多收錢","""親子友善餐廳備有兒童椅及餐具 餐點美味份量十足 下次來花蓮會再光顧"""
花蓮縣,Dos Tacos,花蓮縣花蓮市復興街92號,'038311733',4.5,"{""星期一"": ""休息"", ""星期二"": ""休息"", ""星期三"": ""11:30–13:30、17:30–20:00"", ""星期四"": ""17:30–20:00"", ""星期五"": ""11:30–13:30、17:30–20:00"", ""星期六"": ""11:30–13:30、17:30–20:00"", ""星期日"": ""11:30–13:30、17:30–20:00""}","""很美味的墨西哥菜，食材新鮮，品質非常好，甜點和飲料也很棒！""","""當天點了玉米脆餅，牛肉迪亞起司烤餅, 豬肉焗烤, 炸冰淇淋, Mojito.""","""老闆娘也十分熱情，都會很熱情的介紹店家特色及菜色，有什麼想吃點就對了！"""
花蓮縣,花蓮魚港阿美小吃～代客料理,花蓮縣花蓮市港濱路37號,'0925909599',4.0,"{""星期一"": ""11:00–18:30"", ""星期二"": ""11:00–18:30"", ""星期三"": ""11:00–18:30"", ""星期四"": ""11:00–18:30"", ""星期五"": ""11:00–18:30"", ""星期六"": ""11:00–18:30"", ""星期日"": ""11:00–18:30""}","""推！食材新鮮，出菜速度快，店內冷氣夠涼。""","""現流海鮮新鮮且超便宜，烹調手藝極棒味美價廉，值得再去。""","""既然是觀光漁港，為何是像臨時搭蓋的違章建築？相關單位能不多用點心嗎？"""
花蓮縣,洄瀾灣景觀餐廳｜洄瀾灣休閒農場｜洄瀾灣親子動物區,花蓮縣秀林鄉加灣6-5號,'038268888',4.6,"{""星期一"": ""09:30–17:30"", ""星期二"": ""09:30–17:30"", ""星期三"": ""09:30–17:30"", ""星期四"": ""09:30–17:30"", ""星期五"": ""09:30–17:30"", ""星期六"": ""09:30–17:30"", ""星期日"": ""09:30–17:30""}","""牛奶螃蟹鍋算是不錯 無菜單料理，有一道飯配韭菜， 覺得這道是什麼平凡的料理…""","""和羊群及園區動物們很好互動的地方，門票值回票價，員工熱心指引，經過會再來💯💯💯""","""擺盤。菜色口味迷人。首推牛奶鍋，湯頭順口不膩。宜蘭糕渣外酥內嫩，口感豐富。"""
花蓮縣,老時光燒肉酒肴,花蓮縣花蓮市民國路88-1號,'038315848',4.8,"{""星期一"": ""17:00–00:00"", ""星期二"": ""17:00–00:00"", ""星期三"": ""17:00–00:00"", ""星期四"": ""17:00–00:00"", ""星期五"": ""17:00–00:00"", ""星期六"": ""17:00–00:00"", ""星期日"": ""17:00–00:00""}","""現場氣氛很好，部分是日式風格的坐位區（坐久有點腳麻就是） 餐點口味份量都很不錯！""","""豬雞串燒/炸物/湯品/烤飯糰/麵料理/酒類、沙瓦、和冷靜係（無酒精）飲料。""","""服務好 出餐速度快 份量剛好 剝皮辣椒牛肉 主廚牛肉 再來杯冰啤酒 啵棒！"""
花蓮縣,紐約客牛排館,花蓮縣花蓮市林森路122號,'038360928',4.5,"{""星期一"": ""11:00–21:00"", ""星期二"": ""11:00–21:00"", ""星期三"": ""11:00–21:00"", ""星期四"": ""11:00–21:00"", ""星期五"": ""11:00–21:00"", ""星期六"": ""11:00–21:00"", ""星期日"": ""11:00–21:00""}","""餐點很讚、種類豐富 服務和氣氛也很棒～ 很適合家庭和朋友聚餐的地方💓""","""CP值很高的餐廳 食材用料新鮮，用餐環境衛生好。""","""服務人員非常親切，解說介紹，雖是第一次來，感受像老顧客一樣的溫暖熟悉"""
花蓮縣,米那度海吧餐廳,花蓮縣花蓮市林森路215號,'038355088',4.3,"{""星期一"": ""11:00–13:30、17:00–21:00"", ""星期二"": ""11:00–13:30、17:00–21:00"", ""星期三"": ""休息"", ""星期四"": ""11:00–13:30、17:00–21:00"", ""星期五"": ""11:00–13:30、17:00–21:00"", ""星期六"": ""11:00–13:30、17:00–21:00"", ""星期日"": ""11:00–13:30、17:00–21:00""}","""老闆的用心讓客人感受的到，食材新鮮份量足夠，無菜單料理值得推薦～""","""我一碗海鮮湯麵，烤個鮭魚頭！就足夠兩夫妻滿足非常；勝過大飯店！""","""利麵所以點了［塔香蛤蜊麵］，原以為是義大利麵，結果是＂雞蛋麵＂。"""
花蓮縣,小小兔子廚房,花蓮縣花蓮市明義街51號,'038350038',3.9,"{""星期一"": ""休息"", ""星期二"": ""11:00–15:00、17:30–21:00"", ""星期三"": ""11:00–15:00、17:30–21:00"", ""星期四"": ""11:00–15:00、17:30–21:00"", ""星期五"": ""11:00–15:00、17:30–21:00"", ""星期六"": ""10:30–15:30、17:30–21:00"", ""星期日"": ""10:30–15:30""}","""文青型的早午餐餐廳，咖啡、紅茶無限自取是特色，食物不錯吃，CP值高。值得推薦。""","""溫馨用餐環境，餐點清淡不油膩，配菜小菜可以續，飲料自取，奶茶、紅茶、無糖洛神茶。""","""食物上，輕食炸雞排餐，擺盤精緻、手作麵包Q彈；火鍋野菜吃到飽，非常喜歡！"""
花蓮縣,食舍海鮮餐廳,花蓮縣花蓮市中華路306號,'038359687',4.3,"{""星期一"": ""休息"", ""星期二"": ""11:30–14:00、17:30–21:00"", ""星期三"": ""11:30–14:00、17:30–21:00"", ""星期四"": ""11:30–14:00、17:30–21:00"", ""星期五"": ""11:30–14:00、17:30–21:00"", ""星期六"": ""11:30–14:00、17:30–21:00"", ""星期日"": ""11:30–14:00、17:30–21:00""}","""週三晚餐在花蓮覓食 感謝計程車司機的推薦 四菜一湯 除了烤魚下巴 其他都推薦""","""三五好友聚餐的好地方，菜餚料理好棒，食材美味好鮮。""","""服務生對帶小孩子的較不體諒，裡面空間較擠不適合帶嬰兒車去"""
花蓮縣,美兆廚房,花蓮縣花蓮市自由街130號,'038321058',4.3,"{""星期一"": ""11:00–14:00、17:00–21:00"", ""星期二"": ""休息"", ""星期三"": ""11:00–14:00、17:00–21:00"", ""星期四"": ""11:00–14:00、17:00–21:00"", ""星期五"": ""11:00–14:00、17:00–21:00"", ""星期六"": ""11:00–14:00、17:00–21:00"", ""星期日"": ""11:00–14:00、17:00–21:00""}","""多樣化的食物，專業廚師料理，味道口感很好。地點又在市區，值得推薦再去吃的餐廳選擇""","""身為花蓮人長期在台北，最近才知道這家，好吃又有特色，食材新鮮很適合團體聚餐。""","""海鮮新鮮、菜色豐富、口味一級棒、老闆娘漂亮。"""
花蓮縣,天鵝先生的私房小館,花蓮縣花蓮市府前路94號,None,3.8,"{""星期一"": ""11:00–14:00、17:00–20:00"", ""星期二"": ""11:00–14:00、17:00–20:00"", ""星期三"": ""11:00–14:00、17:00–20:00"", ""星期四"": ""11:00–14:00、17:00–20:00"", ""星期五"": ""11:00–14:00、17:00–20:00"", ""星期六"": ""11:00–14:00、17:00–20:00"", ""星期日"": ""11:00–14:00、17:00–20:00""}","""德國豬腳，肋排都很夠味。份量也很棒。""","""宅配的匈牙利燉肉。份量超足！好好吃～🥰""",None
花蓮縣,木子食堂,花蓮縣花蓮市博愛街238號,'038322038',4.5,"{""星期一"": ""18:00–23:30"", ""星期二"": ""18:00–23:30"", ""星期三"": ""休息"", ""星期四"": ""18:00–23:30"", ""星期五"": ""18:00–23:30"", ""星期六"": ""18:00–23:30"", ""星期日"": ""18:00–23:30""}","""點了許多道菜 食材新鮮無地雷 推薦燒烤類 價格與台北相比算公道 店員服務良好""","""日式燒烤店，適合宵夜小酌，停車空間有限，店內座位不多，氣氛寧靜悠閒。""","""在菜單上，有寫在店內牆上，像是蛤蜊湯、酒蒸蛤蜊、雞腿軟骨等等。"""
花蓮縣,美崙海鮮,花蓮縣花蓮市中美路263-2號,'038246117',4.1,"{""星期一"": ""休息"", ""星期二"": ""11:00–14:00、17:00–21:00"", ""星期三"": ""11:00–14:00、17:00–21:00"", ""星期四"": ""11:00–14:00、17:00–21:00"", ""星期五"": ""11:00–14:00、17:00–21:00"", ""星期六"": ""11:00–14:00、17:00–21:00"", ""星期日"": ""11:00–14:00、17:00–21:00""}","""龍蝦＋雞肉＋蟹麻酒湯，聽老闆說有自家船進貨鮮，價格公道""","""草蝦新鮮彈牙，牧草雞油嫩，咖哩粉醃炸花枝可以，炒山蘇嫩脆，蛤蜊曼波魚湯鮮甜。""","""食材新鮮 料理好吃 燒烤類因為只有一個爐 時間較久 另外位置不多 建議先訂位"""
花蓮縣,五餅二魚,花蓮縣壽豐鄉魚池45號,'038651333',3.6,"{""星期一"": ""10:00–19:00"", ""星期二"": ""10:00–19:00"", ""星期三"": ""10:00–19:00"", ""星期四"": ""10:00–19:00"", ""星期五"": ""10:00–19:00"", ""星期六"": ""10:00–19:00"", ""星期日"": ""10:00–19:00""}","""這類熱炒店的菜單中🤣） 魚下巴跟炒高麗菜尚可 但是鹽烤台灣鯛超好吃 肉質鮮嫩多汁""","""很有地方特色的餐廳，黄金硯系列菜(炒蜊仔，蜊仔薑絲湯，鹹蜆)為主題。""","""菜色多樣，也可單點，也可和菜，服務親切，場地寬闊，氣氛滿滿直接推薦嚕。"""
花蓮縣,慶文漁夫料理,花蓮縣花蓮市國民九街41號,'0916571723',4.5,"{""星期一"": ""17:00–21:00"", ""星期二"": ""17:00–22:00"", ""星期三"": ""休息"", ""星期四"": ""17:00–21:00"", ""星期五"": ""17:00–21:00"", ""星期六"": ""17:00–21:00"", ""星期日"": ""17:00–21:00""}","""口味不錯，海鮮食材新鮮，鮪魚生魚片是特色。""","""一定要湊一桌人來吃無菜單料理，我懷疑是漁夫老闆自己開的店，菜色很棒又很少吃到。""","""每道菜都非常好吃，連小孩都非常喜歡，有機會去花蓮旅遊一定會再去吃👍"""
