region,title,address,phone,score,open_time,comment1,comment2,comment3
屏東縣,阿漢私廚 (預約制.請至少提前一天預約點餐)屏東美食 屏東私房菜 屏東餐廳推薦 勝利星村美食 屏東restaurant,屏東縣屏東市重慶路必勝巷4號,'087333323',4.5,"{""星期一"": ""10:30–14:00、17:30–20:30"", ""星期二"": ""休息"", ""星期三"": ""10:30–14:00、17:30–20:30"", ""星期四"": ""10:30–14:00、17:30–20:30"", ""星期五"": ""10:30–14:00、17:30–20:30"", ""星期六"": ""10:30–14:00、17:30–20:30"", ""星期日"": ""10:30–14:00、17:30–20:30""}","""東坡肉有失望，水煮魚套餐和牛肉套餐一般般，看不到師父的功力""","""幫我爸爸過生日 服務超讚 主廚還會介紹甜點","""舒服隱私的用餐環境，協助客人的用心服務，菜品的口味及食材可以"""
屏東縣,北平孔家小館 屏東店,屏東縣屏東市自由路315號,'087383900',4.1,"{""星期一"": ""11:30–13:45、17:30–20:30"", ""星期二"": ""11:30–13:45、17:30–20:30"", ""星期三"": ""休息"", ""星期四"": ""休息"", ""星期五"": ""11:30–13:45、17:30–20:30"", ""星期六"": ""11:00–13:45、17:00–20:30"", ""星期日"": ""11:00–13:45、17:00–20:30""}","""酸辣湯麵料多。大滷麵很大碗 牛肉拌麵吃不飽。甜烙餅還行會膩 蒸餃像水餃","""翡翠海鮮羹：湯頭很棒，蛤蜊、蟹肉、蝦仁，但可惜有蟹味絲。""","""北方小吃，捲餅...等，口味佳，推薦小米粥(冰),服務超好，棒棒棒"""
屏東縣,屏東簡餐 飲料吧 環遊世界吧,屏東縣屏東市濟南街2-5號,'0922577094',5.0,None,"""飲料cp值高 老闆人很好 很推～～～會再訪""","""飲料40$起，非常便宜喔，闆娘都很好聊，樓上還有住宿呢~歡迎內洽~~~""","""小小的店，裝進了全世界，闆娘的旅行經驗不吝嗇與你分享"""
屏東縣,潮麵（寵物友善、親子餐廳）,屏東縣潮州鎮新生二巷1號,'087896000',4.8,"{""星期一"": ""休息"", ""星期二"": ""11:00–14:15、17:00–20:15、21:00–02:00"", ""星期三"": ""11:00–14:15、17:00–20:15、21:00–02:00"", ""星期四"": ""11:00–14:15、17:00–20:15、21:00–00:30"", ""星期五"": ""11:00–14:15、17:00–20:15、21:00–00:00"", ""星期六"": ""00:00–14:15、17:00–20:15、21:00–02:00"", ""星期日"": ""11:00–14:15、17:00–20:15""}","""滷味的高麗菜和肉都好好吃😋 餛飩湯內的餛飩內餡飽滿，連小孩都愛！""","""店家服務態度非常好 店內有小朋友遊戲區，環境乾淨👍 麵食也非常好吃""","""宵夜場很優秀，潮州夜晚好去處！老闆很拼！年輕人很棒！加油💪"""
屏東縣,平埔黑豬食堂,屏東縣屏東市仁德路43巷4號1樓,'0907323237',3.9,"{""星期一"": ""休息"", ""星期二"": ""休息"", ""星期三"": ""11:30–14:00、17:00–19:30"", ""星期四"": ""11:30–14:00、17:00–19:30"", ""星期五"": ""11:30–14:00、17:00–19:30"", ""星期六"": ""11:30–14:00、17:00–19:30"", ""星期日"": ""11:30–14:00、17:00–19:30""}","""第一次用餐，選擇開幕套餐：一碗香腸飯、一碗湯跟一碟青菜，105元。""","""飯湯菜都好吃！推薦給來到附近想吃好吃肉燥飯的各位！也謝謝老闆提供那麼好吃的餐點！""","""下午來到屏東新景點職人町，第一站就來到超好吃我～平埔黑豬開的餐廳享用喔！"""
屏東縣,茵特拉根複合式庭園餐廳,屏東縣潮州鎮彭城路115-2號,'087886067',4.2,"{""星期一"": ""休息"", ""星期二"": ""11:00–14:30、17:00–20:00"", ""星期三"": ""11:00–14:30、17:00–20:00"", ""星期四"": ""11:00–14:30、17:00–20:00"", ""星期五"": ""11:00–14:30、17:00–20:00"", ""星期六"": ""11:00–14:30、17:00–20:00"", ""星期日"": ""11:00–14:30、17:00–20:00""}","""服務很好，餐點豐富，火鍋🍲食材新鮮， 食材沒有火鍋料都是蔬食很棒，焗烤也很好吃😋""","""火鍋菜色多元又超新鮮 番茄養生和牛奶湯頭都好喝 素食的菇菇燉飯也超好吃～～""","""套餐很好吃(豬排，泰式雞，三杯雞都很好吃，肉的分量很足)。"""
屏東縣,保師傅歐風餐館 #義大利麵#燉飯#恐龍造型絲瓜絡文創藝術#親子美食#屏東歐式自助餐外燴外送餐廳推薦#屏東吃喝玩樂#勝利星村附近#千禧圖書館附近巷弄餐廳#屏東QParking#餐廳團體預約包場#複合式簡餐#個人鍋物#屏東縣民公園#屏東勝利星村,屏東縣屏東市公義街17號1樓,'0927252816',4.6,None,"""店裡供應各式異國料理，排餐簡餐、飯麵、素食、炸物等等都有。""","""海鮮燉飯太鹹，火鍋湯底太油，怎麼和上次吃的不一樣呢""","""另外還附了水果沙拉丶薯泥捲丶玉米濃湯和西米露，超飽！醣類很夠，其實不用飯了。"""
屏東縣,SUGARbISTRO (日食糖224),屏東縣屏東市康定街22號,None,4.6,"{""星期一"": ""11:00–20:00"", ""星期二"": ""11:00–20:00"", ""星期三"": ""11:00–20:00"", ""星期四"": ""11:00–20:00"", ""星期五"": ""11:00–20:00"", ""星期六"": ""11:00–20:00"", ""星期日"": ""11:00–20:00""}","""建築及室內裝潢擺設很有慢活的味道 餐點以棕梠糖的咖啡、蛋糕及早午餐部分很推薦""","""我們這次點了豬肋排、柬式酸辣椰奶海鮮義大利麵、香草奶油檸檬嫩雞燉飯。""","""氣氛很舒服的店，眷村改成餐廳 麵包、蛋糕很好吃，飲料很大杯 金沙意大利麵也很好吃"""
屏東縣,上尹好食,屏東縣內埔鄉德美路283號,'087781260',4.6,"{""星期一"": ""休息"", ""星期二"": ""11:30–14:00、17:30–21:00"", ""星期三"": ""11:30–14:00、17:30–21:00"", ""星期四"": ""11:30–14:00、17:30–21:00"", ""星期五"": ""11:30–14:00、17:30–21:00"", ""星期六"": ""11:30–14:00、17:30–21:00"", ""星期日"": ""11:30–14:00、17:30–21:00""}","""餐點很美味，店家服務很好，搭配的湯品很棒，飲品也是，整體來說就是平價五星級餐廳。""","""簡單健康好吃的料理，有義大利麵,燉飯,火鍋,烤餅及點心。""","""環境優雅，老闆娘親切，最值得推薦的是這店全部用原裝進口的橄欖油做菜。"""
屏東縣,巴菲樂美食餐廳,屏東縣長治鄉瑞光路一段337號,'087222798',4.0,"{""星期一"": ""11:00–15:00、17:00–22:00"", ""星期二"": ""11:00–15:00、17:00–22:00"", ""星期三"": ""11:00–15:00、17:00–22:00"", ""星期四"": ""11:00–15:00、17:00–22:00"", ""星期五"": ""11:00–15:00、17:00–22:00"", ""星期六"": ""11:00–15:00、17:00–22:00"", ""星期日"": ""11:00–15:00、17:00–22:00""}","""氣氛佳 服務親切 種類多 （炸物 牛排、水果⋯）湯品推薦養身，適合全家團聚""","""物超所值螃蟹蛤蜊鮮蝦鍋，牛羊豬排握壽司不限次數點，空間還蠻寬敞的，停車也方便。""","""排餐出菜速度快肉品質不錯 火鍋肉片彈牙 火鍋料補貨速度有點慢 整體用餐環境還不錯"""
屏東縣,十里藍山復合式餐廳,屏東縣潮州鎮興隆路229之1號,'0955713100',4.7,"{""星期一"": ""18:00–02:00"", ""星期二"": ""18:00–02:00"", ""星期三"": ""18:00–02:00"", ""星期四"": ""18:00–02:00"", ""星期五"": ""18:00–02:00"", ""星期六"": ""18:00–02:00"", ""星期日"": ""18:00–02:00""}","""餐點的部份，我喜歡咖哩雞柳飯的咖哩，有椰奶和一些香料的味道，不辣，好吃。""","""食物新鮮料又多，老闆還送甜點，真心覺得不錯。""","""火鍋好吃，肉片好多，CP值高👍推推推"""
屏東縣,上海工廠 Factory26,屏東縣屏東市上海路26號,'0907549301',4.8,"{""星期一"": ""休息"", ""星期二"": ""17:00–23:00"", ""星期三"": ""17:00–23:00"", ""星期四"": ""17:00–23:00"", ""星期五"": ""17:00–00:00"", ""星期六"": ""17:00–00:00"", ""星期日"": ""休息""}","""氣氛不錯，冰磚咖啡很好喝，起士泡菜豬肉飯不錯吃，但是有點甜，建議減糖：）""","""適合大家坐下來閒聊的好地方 炒泡麵份量很大碗 套餐飲料還可以續杯 CP值很高👍""","""餐點好吃 茶酒很有特色 屏東很棒的餐酒館"""
屏東縣,AKAME,屏東縣霧台鄉古茶柏安街17巷8號,None,4.7,"{""星期一"": ""休息"", ""星期二"": ""休息"", ""星期三"": ""18:00–00:00"", ""星期四"": ""18:00–00:00"", ""星期五"": ""18:00–00:00"", ""星期六"": ""18:00–00:00"", ""星期日"": ""18:00–00:00""}","""原住民特色料理注入法式料理的靈魂 服務態度很好，餐廳解說專業讓顧客心情愉悅""","""海鮮的生熟度完美，牛肉軟嫩美味，吉拿棒如記憶中一樣完美，酒足飯飽的一餐。""","""原住民的民宿 手工蛋糕超美味 比台北的蛋糕 另有一種絕對鄉村天然食材的香氣"""
屏東縣,走廊倉廚 Zaolong 屏東貳號倉,屏東縣屏東市自由路548號,'087328339',3.9,"{""星期一"": ""11:00–22:00"", ""星期二"": ""11:00–22:00"", ""星期三"": ""11:00–22:00"", ""星期四"": ""11:00–22:00"", ""星期五"": ""11:00–22:00"", ""星期六"": ""11:00–22:00"", ""星期日"": ""11:00–22:00""}","""空間舒適，客人多時回音較大 火鍋、德國豬腳口味都屬中上， 適合三五好友聚會","""餐點是採用套餐制，我們點的有附飲料和點心，不過蛤蜊湯的蛤蜊有點小就是了。""","""5、水杯裡沒水了卻沒人服務（服務費到底是付什麼意思的🤔）"""
屏東縣,春日佐光。人文和風燒鍋(屏東仁愛門市),屏東縣屏東市仁愛路14-1號,'087517325',4.0,"{""星期一"": ""11:00–22:30"", ""星期二"": ""11:00–22:30"", ""星期三"": ""11:00–22:30"", ""星期四"": ""11:00–22:30"", ""星期五"": ""11:00–22:30"", ""星期六"": ""11:00–22:30"", ""星期日"": ""11:00–22:30""}","""牛肉的品質很優 但壽喜燒的湯頭過甜，而且沒有冰品 巨量套餐C/P值夠""","""建築具有特色 位置多適合和親朋好友一起吃 有廁所 還有草地，飯可以無限供應""","""基礎鍋底，吧台蔬菜無限供應。飲料、冰淇淋、奶茶、白飯、少量喜瑞爾供應。"""
屏東縣,莎露烘焙餐廳 屏東店,屏東縣屏東市青島街104號,'087336135',4.0,"{""星期一"": ""11:30–15:00、17:00–20:40"", ""星期二"": ""11:30–15:00、17:00–20:40"", ""星期三"": ""11:30–15:00、17:00–20:40"", ""星期四"": ""11:30–15:00、17:00–20:40"", ""星期五"": ""11:30–15:00、17:00–20:40"", ""星期六"": ""11:30–15:00、17:00–20:40"", ""星期日"": ""11:30–15:00、17:00–20:40""}","""保留了日式建築的風格 雞腿排義大利麵跟鮮奶紅茶很棒！""","""折衷式的設計。生意很好，餐點不錯。是屏東市將軍眷村區的代表餐廳。""","""這次升級的套餐選擇沙拉跟飲料，黑咖啡偏酸。"""
屏東縣,河豚海鮮餐館,屏東縣屏東市瑞光路三段259號,'087373759',4.4,"{""星期一"": ""16:00–00:00"", ""星期二"": ""16:00–00:00"", ""星期三"": ""16:00–00:00"", ""星期四"": ""16:00–00:00"", ""星期五"": ""16:00–00:00"", ""星期六"": ""16:00–00:00"", ""星期日"": ""16:00–00:00""}","""商店好找有，有附廁所， 主廚手藝好 價位尚可，營業時間可以比較晚， 小酌輕鬆有趣""","""食材非常新鮮！老闆廚藝一流！非常好吃！屏東在地私房好店～涼拌筍很清甜好吃，推！""","""別人點的菜，我也不知道自己吃了什麼，但都不雷，炒飯好吃"""
屏東縣,風刮地秋月的店(不接受電話預約，請上臉書私訊),屏東縣三地門鄉中正路二段150號,'087991524',4.3,"{""星期一"": ""11:00–18:30"", ""星期二"": ""11:00–18:30"", ""星期三"": ""11:00–18:30"", ""星期四"": ""休息"", ""星期五"": ""11:00–23:00"", ""星期六"": ""11:00–23:00"", ""星期日"": ""11:00–23:00""}","""是一處風景極佳放鬆心情的好地方 原住民烤肉餐點 擺盤 口味 用心 很棒棒。""","""雞腿排輕食套餐(+檸檬山胡椒油醋醬) 🐽炸薯條 🐽阿薩姆紅茶 🐽桂花茶","""若不用正餐，亦可單點飲料(咖啡，冰品，奶茶，果汁，風味茶，微醺飲料)。"""
屏東縣,新紅館餐廳,屏東縣內埔鄉學人路408號,None,4.0,"{""星期一"": ""11:00–14:00、17:00–20:30"", ""星期二"": ""11:00–14:00、17:00–20:30"", ""星期三"": ""11:00–14:00、17:00–20:30"", ""星期四"": ""11:00–14:00、17:00–20:30"", ""星期五"": ""11:00–14:00、17:00–20:30"", ""星期六"": ""11:00–14:00、17:00–20:30"", ""星期日"": ""11:00–14:00、17:00–20:30""}","""停車方便，台菜口味中規中矩，份量多，但座位稍狹窄，設備裝潢也老舊？""","""餐點好吃，尤其是麻油雞飯！老闆有誠意，不但菜色好，而且菜量都是大盤大盤的....""","""屏東內埔 道地美食 聚會婚宴好地方 有機會或要結婚千萬別錯過～"""
屏東縣,鮪吧 Way Bar,屏東縣屏東市民生路255號,'087321492',4.5,"{""星期一"": ""11:30–21:00"", ""星期二"": ""11:30–21:00"", ""星期三"": ""11:30–21:00"", ""星期四"": ""11:30–21:00"", ""星期五"": ""11:30–21:00"", ""星期六"": ""11:30–21:00"", ""星期日"": ""11:30–21:00""}","""服務人員親切 有水果肉類 霜淇淋 蛋糕 飲料 甜點 價格不貴，適合家庭聚餐""","""服務態度很不錯 明太子墨魚義大利麵好吃 如果有生菜沙拉會更好""","""以餐廳的價位來看，餐點品質是有待加強的，不管是主餐還是沙拉吧，都有很大的進步空間"
屏東縣,佬媽子,屏東縣屏東市中華路57-1號,'087666830',4.7,"{""星期一"": ""休息"", ""星期二"": ""11:00–15:00、17:30–23:00"", ""星期三"": ""11:00–15:00、17:30–23:00"", ""星期四"": ""11:00–15:00、17:30–23:00"", ""星期五"": ""11:00–15:00、17:30–23:00"", ""星期六"": ""11:00–15:00、17:30–23:00"", ""星期日"": ""11:00–15:00、17:30–23:00""}","""氣氛很棒～椒麻雞好吃，苳陰酸辣海鮮河粉好吃，湯底很濃，泰式紅奶茶很讚！""","""餐點選擇多，價也錢合理，食物口味也很好料也豐富，環境優美有特色，不過停車不方便。""","""和朋友聚會聊天喝飲料吃小吃的好去處 老闆店員也都很親切喔！"""
屏東縣,想家的家（橘之花川菜）,屏東縣屏東市青島街118號,'087328488',4.6,"{""星期一"": ""休息"", ""星期二"": ""11:00–14:00、17:00–20:30"", ""星期三"": ""11:00–14:00、17:30–20:30"", ""星期四"": ""11:00–14:00、17:00–20:30"", ""星期五"": ""11:00–14:00、17:00–21:00"", ""星期六"": ""11:00–14:00、17:00–21:00"", ""星期日"": ""11:00–14:00、17:00–20:30""}","""最喜歡剁椒魚條、檸檬雞、水煮肉、酸蘿蔔老鴨湯，下次想再點其他沒吃到的~~~""","""老闆娘和員工都很和善，出餐很快，家庭聚餐還有包廂可選，感謝店家當日贈送壽星小禮物","""餐點有特色，推薦麻油雞炒飯，不油不鹹，粒粒分明很好吃、番茄蛋湯也不錯。"""
屏東縣,木川崌咖啡火鍋餐飲,屏東縣屏東市公園東路47號,'087233018',4.1,"{""星期一"": ""11:00–22:00"", ""星期二"": ""11:00–22:00"", ""星期三"": ""11:00–22:00"", ""星期四"": ""11:00–22:00"", ""星期五"": ""11:00–22:00"", ""星期六"": ""11:00–22:30"", ""星期日"": ""11:00–22:30""}","""CP值算不錯，推薦咖哩焗烤飯，口味上可以""","""奶茶很甜 餐點部分普通 服務不錯 湯與主餐不搭""","""食材品質佳好吃，價錢親民，環境衛生不錯，老闆及老闆娘服務態度佳，值得去“消费”。"""
屏東縣,義式屋古拉爵 屏東太平洋店,屏東縣屏東市中正路72號,'087661127',3.9,"{""星期一"": ""11:00–22:00"", ""星期二"": ""11:00–22:00"", ""星期三"": ""11:00–22:00"", ""星期四"": ""11:00–22:00"", ""星期五"": ""11:00–22:00"", ""星期六"": ""11:00–22:00"", ""星期日"": ""11:00–22:00""}","""餐點方面，牛肝菌濃湯、究好豬櫻桃鴨Pizza和牛排讓人印象深刻。""","""份量已經夠多了，在湯品的部分還蠻推薦牛肉羅宋湯。沙拉的部分油醋沙拉還蠻清爽的。""","""主餐點了紅醬的焗烤蝦球麵、白醬的起司雞肉麵。"""
屏東縣,無二台菜概念館,屏東縣屏東市中山路229號,'087655288',4.4,"{""星期一"": ""休息"", ""星期二"": ""11:00–14:30、17:30–21:30"", ""星期三"": ""11:00–14:30、17:30–21:30"", ""星期四"": ""11:00–14:30、17:30–21:30"", ""星期五"": ""11:00–14:30、17:30–21:30"", ""星期六"": ""11:00–14:30、17:30–21:30"", ""星期日"": ""11:00–14:30、17:30–21:30""}","""空間寬敞明亮冷氣夠冷，服務人員態度佳，菜色多樣食材新鮮，香腸與鹹豬肉非常有特色","""環境舒服、餐點便宜好吃，大推金沙豆腐、宮保雞丁、脆皮肥腸、花枝丸、蛤蠣魚湯！""","""價格公道，裝潢設計美感還不錯，蛤蜊蒜頭雞湯如果鹽放少一點就可以空鍋了^^"""
屏東縣,三倆三私房菜,屏東縣屏東市廣東路300號,'087361533',4.5,"{""星期一"": ""11:00–14:00、17:00–21:00"", ""星期二"": ""11:00–14:00、17:00–21:00"", ""星期三"": ""11:00–14:00、17:00–21:00"", ""星期四"": ""11:00–14:00、17:00–21:00"", ""星期五"": ""11:00–14:00、17:00–21:00"", ""星期六"": ""11:00–14:00、17:00–21:00"", ""星期日"": ""11:00–14:00、17:00–21:00""}","""用餐環境與餐具乾淨、門口望出去是寬闊的公園與圖書館，美食配美景，棒棒的！""","""餐點部分上餐速度極快，份量也很足夠，菜色吃起來沒有什麼太大的問題，色香味俱全。""","""包廂很美，過年要滿7000元，必點老皮嫩肉 芥末牛肉跟酸白菜牛肉也好吃❤️"""
屏東縣,Le Gaulois 高蘆法式餐廳,屏東縣屏東市青島街93號,'087663212',4.0,"{""星期一"": ""12:00–22:00"", ""星期二"": ""12:00–22:00"", ""星期三"": ""12:00–22:00"", ""星期四"": ""休息"", ""星期五"": ""12:00–22:00"", ""星期六"": ""12:00–22:00"", ""星期日"": ""12:00–22:00""}","""無懈可擊的餐點 從接待人員的專業 至每道料理及咖啡、甜點 都是美好的體驗""","""老闆娘人真的很熱情 室內氣氛也ok 不過不同主餐份量和CP實在差太多了""","""菜色可以感受到主廚的用心 環境整潔舒適 CP值超高👍"""
屏東縣,勝利星村波克夏餐廳-種子2號店（勝利星村美食 親子餐廳 屏東特色餐廳 舒適的餐廳 下午茶 勝利星村景點 國旅卡特約店）,屏東縣屏東市青島街96號,'087338280',4.5,"{""星期一"": ""11:30–20:30"", ""星期二"": ""11:30–20:30"", ""星期三"": ""11:30–15:30"", ""星期四"": ""11:30–20:30"", ""星期五"": ""11:30–21:00"", ""星期六"": ""11:00–21:30"", ""星期日"": ""11:30–21:00""}","""有小朋友的遊樂小空間，室內、室外區都有，餐點價位在這一區屬中低價位。""","""滑蛋變煎蛋，壽喜燒牛變鍋燒湯飯，鮮奶茶沒茶味。""","""東西有點貴，一碗沒什麼特別的豆花要80...裝潢以前是大和咖啡，但現在有點亂雜"""
屏東縣,新享天風味家常菜,屏東縣屏東市北興街16號,'087376161',4.1,"{""星期一"": ""11:00–14:00、17:30–21:00"", ""星期二"": ""11:00–14:00、17:30–21:00"", ""星期三"": ""休息"", ""星期四"": ""休息"", ""星期五"": ""11:00–14:00、17:30–21:00"", ""星期六"": ""11:00–14:00、17:30–21:00"", ""星期日"": ""11:00–14:00、17:30–21:00""}","""全家大小來聚餐。甜點山粉圓湯好好喝，是小時候的味道。""","""東西很好吃，也都做得很有特色，白飯可以吃到飽，店員也很親切的講解餐點。""","""梅乾菜扣肉太鹹！幸好魚很新鮮！停車位不易找。座位寬敞。"""
屏東縣,大將日本料理,屏東縣屏東市信義路143號,'087327537',4.1,"{""星期一"": ""11:00–14:00、17:00–21:00"", ""星期二"": ""11:00–14:00、17:00–21:00"", ""星期三"": ""11:00–14:00、17:00–21:00"", ""星期四"": ""11:00–14:00、17:00–21:00"", ""星期五"": ""11:00–14:00、17:00–21:00"", ""星期六"": ""11:00–14:00、17:00–21:00"", ""星期日"": ""11:00–14:00、17:00–21:00""}","""食材新鮮，料理口味也好。推薦櫻花蝦炒飯，炸天婦羅，鮭魚鮪魚生魚片，烤赤宗魚","""今日素食餐點： 蔬菜手捲、蔬菜沙拉、天婦羅、炒烏龍、菇菇湯。""","""裝潢別緻用餐場地寬廣舒適，菜色美味可口，在屏東地區算是高檔級日式料理餐廳。"""
屏東縣,屏東美食-海草魚美食館,屏東縣屏東市華盛街6-7號,'087528057',4.3,"{""星期一"": ""10:30–14:00、17:00–20:00"", ""星期二"": ""10:30–14:00、17:00–20:00"", ""星期三"": ""10:30–14:00、17:00–20:00"", ""星期四"": ""10:30–14:00、17:00–20:00"", ""星期五"": ""10:30–14:00、17:00–20:00"", ""星期六"": ""10:30–14:00、17:00–20:00"", ""星期日"": ""休息""}","""口味簡單，菜色多，價格合理，環境乾淨，適合家庭小食。""","""東餐廳推薦 #屏東平價小吃 #屏東平價美食推薦#海草魚美食館 #阿志吃什麼","""魚肚湯：湯頭不錯，中上級。"""
屏東縣,湘菜私房料理&秀音樂咖啡館,屏東縣屏東市和平路495號,'0910759793',4.8,"{""星期一"": ""11:30–21:00"", ""星期二"": ""11:30–21:00"", ""星期三"": ""11:30–21:00"", ""星期四"": ""11:30–21:00"", ""星期五"": ""11:30–21:00"", ""星期六"": ""11:30–21:00"", ""星期日"": ""11:30–21:00""}","""重視酸和辣。但這間湘菜能夠依照顧客口味調整大.中.小.辣度，真是太棒了！""","""道地湖南菜，位子不多，最好先預訂，附件有全聯可停車。""","""另外，不敢吃辣的人可以點韭菜炒花枝、滑蛋牛肉，超嫩！料理都很下飯喔！👍"""
屏東縣,雲清活蝦庭園餐廳,屏東縣萬巒鄉三多路2之8號,'0987338792',4.3,"{""星期一"": ""休息"", ""星期二"": ""11:00–21:00"", ""星期三"": ""09:00–17:00"", ""星期四"": ""11:00–21:00"", ""星期五"": ""11:00–21:00"", ""星期六"": ""11:00–21:00"", ""星期日"": ""11:00–21:00""}","""真的很值得推薦，食材料理的很好吃，服務親切，環境優，適合全家大小聚會場所。""","""蝦子超讚👍👍老闆nice 服務態度好 衛生一級棒出餐速度快""","""口感很差！其他的泰式 檸檬 胡椒也是太濕或調味一般般，建議只點鹽烤蝦吃原味即可。"""
屏東縣,二魚pasta 義大利麵/燉飯/綠咖哩/橘醬/墨魚/屏東餐廳/聚會/推薦,屏東縣屏東市林森路30之16號,'087213005',4.6,"{""星期一"": ""11:30–14:30、17:00–21:00"", ""星期二"": ""11:30–14:30、17:00–21:00"", ""星期三"": ""11:30–14:30、17:00–21:00"", ""星期四"": ""11:30–14:30、17:00–21:00"", ""星期五"": ""11:30–14:30、17:00–21:00"", ""星期六"": ""11:30–14:30、17:00–21:00"", ""星期日"": ""11:30–14:30、17:00–21:00""}","""今天點了綠咖哩雞肉與海鮮的燉飯、雞米花，以及搭配套餐的蕈菇濃湯跟奶酪、無糖綠茶。""","""餐點好吃美味、氣氛溫馨、服務佳，推薦青醬跟白醬，伯爵紅茶也很讚不會太甜""","""停車不方便，建議要停到前面郵局那 桌邊掃碼點餐，櫃檯結帳"
屏東縣,老厝食府（東海堂）晚餐居酒屋/早餐老厝刈包,屏東縣屏東市香楊路6號,None,5.0,None,"""的炒飯炒米粉，口感都很好，刈包還不定時特價，配上店家辣椒再加個蛋，很棒！""","""環境舒服餐點美味😋下次來屏東玩還來""","""小卻溫馨的小店，東西都很用心製作的年輕人，值得"""
屏東縣,水月軒鮮蝦美食餐廳,屏東縣林邊鄉中林路282-21號,'088753299',None,"{""星期一"": ""休息"", ""星期二"": ""16:00–21:00"", ""星期三"": ""16:00–21:00"", ""星期四"": ""16:00–21:00"", ""星期五"": ""16:00–21:00"", ""星期六"": ""15:00–21:00"", ""星期日"": ""15:00–21:00""}","""推薦必吃 檸檬蝦 白酒奶油蛤蜊 冰醉雞 和風炸豆腐 櫻花蝦麵線","""停車場大，蝦子好吃，出菜速度很快。不推客家小炒、鹹豬肉、冷泡茶","""食材新鮮不貴，上菜速度快料理好吃，三五好友吃起來很有氣氛，蒜頭蝦和胡椒蝦必點。"""
屏東縣,水月軒鮮蝦美食餐廳,屏東縣林邊鄉中林路282-21號,None,4.2,None,None,None,None
屏東縣,塔塔城,屏東縣屏東市建豐路2巷129號,'087379966',3.9,"{""星期一"": ""11:00–14:00、17:00–21:00"", ""星期二"": ""11:00–14:00、17:00–21:00"", ""星期三"": ""休息"", ""星期四"": ""11:00–14:00、17:00–21:00"", ""星期五"": ""11:00–14:00、17:00–21:00"", ""星期六"": ""11:00–14:00、17:00–21:00"", ""星期日"": ""11:00–14:00、17:00–21:00""}","""常帶家人來吃，今天的咖哩海鮮湯超級鹹，鹹到喝不下，有跟店家反應，希望要注意一下""","""喜歡他們的玉米濃湯，椒麻雞和飯後甜點西米露，有去屏東就會過去喔⋯⋯""","""味道，不推薦 辣炒豬肉皮蛋-口味可以，皮蛋外皮炸太硬 大概是沒點到他們的推薦菜色"
